paper_title,paper_url
ROAD: Reality Oriented Adaptation for Semantic Segmentation of Urban Scenes,https://arxiv.org/pdf/1711.11556v2.pdf
A Question-Focused Multi-Factor Attention Network for Question Answering,https://arxiv.org/pdf/1801.08290v1.pdf
Sentence Similarity Learning by Lexical Decomposition and Composition,https://arxiv.org/pdf/1602.07019v2.pdf
Recurrent Neural Network Grammars,https://arxiv.org/pdf/1602.07776v4.pdf
Semantic Instance Segmentation with a Discriminative Loss Function,https://arxiv.org/pdf/1708.02551v1.pdf
The QT21/HimL Combined Machine Translation System,https://aclweb.org/anthology/W16-2320
Learning Graph-Level Representation for Drug Discovery,https://arxiv.org/pdf/1709.03741v2.pdf
CU-Net: Coupled U-Nets,https://arxiv.org/pdf/1808.06521v1.pdf
Universum Prescription: Regularization using Unlabeled Data,https://arxiv.org/pdf/1511.03719v7.pdf
Deep Exploration via Bootstrapped DQN,https://arxiv.org/pdf/1602.04621v3.pdf
Fine-Grained Head Pose Estimation Without Keypoints,https://arxiv.org/pdf/1710.00925v5.pdf
Morphosyntactic Tagging with a Meta-BiLSTM Model over Context Sensitive Token Encodings,https://arxiv.org/pdf/1805.08237v1.pdf
Towards Viewpoint Invariant 3D Human Pose Estimation,https://arxiv.org/pdf/1603.07076v3.pdf
Model-Agnostic Meta-Learning for Fast Adaptation of Deep Networks,https://arxiv.org/pdf/1703.03400v3.pdf
An Analysis of Neural Language Modeling at Multiple Scales,https://arxiv.org/pdf/1803.08240v1.pdf
Variational Graph Auto-Encoders,https://arxiv.org/pdf/1611.07308v1.pdf
Convolutional Neural Networks on Graphs with Fast Localized Spectral Filtering,https://arxiv.org/pdf/1606.09375v3.pdf
One-Shot Instance Segmentation,https://arxiv.org/pdf/1811.11507v1.pdf
Large Kernel Matters -- Improve Semantic Segmentation by Global Convolutional Network,https://arxiv.org/pdf/1703.02719v1.pdf
"Deformable ConvNets v2: More Deformable, Better Results",https://arxiv.org/pdf/1811.11168v2.pdf
Diverse Image-to-Image Translation via Disentangled Representations,https://arxiv.org/pdf/1808.00948v1.pdf
Sequence Level Training with Recurrent Neural Networks,https://arxiv.org/pdf/1511.06732v7.pdf
VoxelNet: End-to-End Learning for Point Cloud Based 3D Object Detection,https://arxiv.org/pdf/1711.06396v1.pdf
Breaking the Softmax Bottleneck: A High-Rank RNN Language Model,https://arxiv.org/pdf/1711.03953v4.pdf
Trainable Nonlinear Reaction Diffusion: A Flexible Framework for Fast and Effective Image Restoration,https://arxiv.org/pdf/1508.02848v2.pdf
In Defense of Pre-trained ImageNet Architectures for Real-time Semantic Segmentation of Road-driving Images,https://arxiv.org/pdf/1903.08469v2.pdf
A Multi-sentiment-resource Enhanced Attention Network for Sentiment Classification,https://arxiv.org/pdf/1807.04990v1.pdf
Dense 3D Regression for Hand Pose Estimation,https://arxiv.org/pdf/1711.08996v1.pdf
"BB8: A Scalable, Accurate, Robust to Partial Occlusion Method for Predicting the 3D Poses of Challenging Objects without Using Depth",https://arxiv.org/pdf/1703.10896v2.pdf
Multiple-Human Parsing in the Wild,https://arxiv.org/pdf/1705.07206v2.pdf
Detecting Curve Text in the Wild: New Dataset and New Solution,https://arxiv.org/pdf/1712.02170v1.pdf
Fast Parametric Learning with Activation Memorization,https://arxiv.org/pdf/1803.10049v1.pdf
Recurrent Entity Networks with Delayed Memory Update for Targeted Aspect-Based Sentiment Analysis,https://aclweb.org/anthology/N18-2045
Mode Seeking Generative Adversarial Networks for Diverse Image Synthesis,https://arxiv.org/pdf/1903.05628v5.pdf
FPNN: Field Probing Neural Networks for 3D Data,https://arxiv.org/pdf/1605.06240v3.pdf
Learning a Single Convolutional Super-Resolution Network for Multiple Degradations,https://arxiv.org/pdf/1712.06116v2.pdf
Recurrent Attention Network on Memory for Aspect Sentiment Analysis,https://aclweb.org/anthology/D17-1047
Image Reconstruction with Predictive Filter Flow,https://arxiv.org/pdf/1811.11482v1.pdf
Hypernetwork Knowledge Graph Embeddings,https://arxiv.org/pdf/1808.07018v3.pdf
Group Normalization,https://arxiv.org/pdf/1803.08494v3.pdf
Learning Deep CNN Denoiser Prior for Image Restoration,https://arxiv.org/pdf/1704.03264v1.pdf
Focal Loss for Dense Object Detection,https://arxiv.org/pdf/1708.02002v2.pdf
Translations as Additional Contexts for Sentence Classification,https://arxiv.org/pdf/1806.05516v1.pdf
The NarrativeQA Reading Comprehension Challenge,https://arxiv.org/pdf/1712.07040v1.pdf
SpecAugment: A Simple Data Augmentation Method for Automatic Speech Recognition,https://arxiv.org/pdf/1904.08779v1.pdf
Purpose and Polarity of Citation: Towards NLP-based Bibliometrics,https://aclweb.org/anthology/N13-1067
An Effective Approach to Unsupervised Machine Translation,https://arxiv.org/pdf/1902.01313v1.pdf
Greedy Search for Descriptive Spatial Face Features,https://arxiv.org/pdf/1701.01879v2.pdf
Neural 3D Mesh Renderer,https://arxiv.org/pdf/1711.07566v1.pdf
Learning to Remember Rare Events,https://arxiv.org/pdf/1703.03129v1.pdf
Skip-gram Language Modeling Using Sparse Non-negative Matrix Probability Estimation,https://arxiv.org/pdf/1412.1454v2.pdf
RAM: Residual Attention Module for Single Image Super-Resolution,https://arxiv.org/pdf/1811.12043v1.pdf
"You Only Look Once: Unified, Real-Time Object Detection",https://arxiv.org/pdf/1506.02640v5.pdf
T-Net: Parametrizing Fully Convolutional Nets with a Single High-Order Tensor,https://arxiv.org/pdf/1904.02698v1.pdf
Deformable Convolutional Networks,https://arxiv.org/pdf/1703.06211v3.pdf
Self-Supervised Learning of 3D Human Pose using Multi-view Geometry,https://arxiv.org/pdf/1903.02330v2.pdf
Towards Universal Dialogue State Tracking,https://arxiv.org/pdf/1810.09587v1.pdf
Full-Capacity Unitary Recurrent Neural Networks,https://arxiv.org/pdf/1611.00035v1.pdf
Submanifold Sparse Convolutional Networks,https://arxiv.org/pdf/1706.01307v1.pdf
SWAG: A Large-Scale Adversarial Dataset for Grounded Commonsense Inference,https://arxiv.org/pdf/1808.05326v1.pdf
"Multi-Evidence Filtering and Fusion for Multi-Label Classification, Object Detection and Semantic Segmentation Based on Weakly Supervised Learning",https://arxiv.org/pdf/1802.09129v1.pdf
Learning to Compare: Relation Network for Few-Shot Learning,https://arxiv.org/pdf/1711.06025v2.pdf
A Joint Many-Task Model: Growing a Neural Network for Multiple NLP Tasks,https://arxiv.org/pdf/1611.01587v5.pdf
SJTU-NLP at SemEval-2018 Task 9: Neural Hypernym Discovery with Term Embeddings,https://aclweb.org/anthology/S18-1147
Part-Level Convolutional Neural Networks for Pedestrian Detection Using Saliency and Boundary Box Alignment,https://arxiv.org/pdf/1810.00689v1.pdf
Going Deeper with Convolutions,https://arxiv.org/pdf/1409.4842v1.pdf
Outrageously Large Neural Networks: The Sparsely-Gated Mixture-of-Experts Layer,https://arxiv.org/pdf/1701.06538v1.pdf
Massively Parallel Methods for Deep Reinforcement Learning,https://arxiv.org/pdf/1507.04296v2.pdf
CESI: Canonicalizing Open Knowledge Bases using Embeddings and Side Information,https://arxiv.org/pdf/1902.00172v1.pdf
PixelGAN Autoencoders,https://arxiv.org/pdf/1706.00531v1.pdf
Videos as Space-Time Region Graphs,https://arxiv.org/pdf/1806.01810v2.pdf
DSOD: Learning Deeply Supervised Object Detectors from Scratch,https://arxiv.org/pdf/1708.01241v2.pdf
SegNet: A Deep Convolutional Encoder-Decoder Architecture for Image Segmentation,https://arxiv.org/pdf/1511.00561v3.pdf
Multi-Task Graph Autoencoders,https://arxiv.org/pdf/1811.02798v1.pdf
MEMEN: Multi-layer Embedding with Memory Networks for Machine Comprehension,https://arxiv.org/pdf/1707.09098v1.pdf
YOLACT: Real-time Instance Segmentation,https://arxiv.org/pdf/1904.02689v1.pdf
Table-to-text Generation by Structure-aware Seq2seq Learning,https://arxiv.org/pdf/1711.09724v1.pdf
3D-R2N2: A Unified Approach for Single and Multi-view 3D Object Reconstruction,https://arxiv.org/pdf/1604.00449v1.pdf
Semi-supervised Multitask Learning for Sequence Labeling,https://arxiv.org/pdf/1704.07156v1.pdf
Invariant Information Clustering for Unsupervised Image Classification and Segmentation,https://arxiv.org/pdf/1807.06653v3.pdf
Fused DNN: A deep neural network fusion approach to fast and robust pedestrian detection,https://arxiv.org/pdf/1610.03466v2.pdf
Large-Scale Learnable Graph Convolutional Networks,https://arxiv.org/pdf/1808.03965v1.pdf
On First-Order Meta-Learning Algorithms,https://arxiv.org/pdf/1803.02999v3.pdf
Deep CNN ensembles and suggestive annotations for infant brain MRI segmentation,https://arxiv.org/pdf/1712.05319v2.pdf
Multi-attention Recurrent Network for Human Communication Comprehension,https://arxiv.org/pdf/1802.00923v1.pdf
Deep Recurrent Models with Fast-Forward Connections for Neural Machine Translation,https://arxiv.org/pdf/1606.04199v3.pdf
Subcategory-aware Convolutional Neural Networks for Object Proposals and Detection,https://arxiv.org/pdf/1604.04693v3.pdf
What Can Help Pedestrian Detection?,https://arxiv.org/pdf/1705.02757v1.pdf
Tying Word Vectors and Word Classifiers: A Loss Framework for Language Modeling,https://arxiv.org/pdf/1611.01462v3.pdf
The PyTorch-Kaldi Speech Recognition Toolkit,https://arxiv.org/pdf/1811.07453v2.pdf
Noise Contrastive Estimation and Negative Sampling for Conditional Models: Consistency and Statistical Efficiency,https://arxiv.org/pdf/1809.01812v1.pdf
Improved Variational Autoencoders for Text Modeling using Dilated Convolutions,https://arxiv.org/pdf/1702.08139v2.pdf
Conversational Memory Network for Emotion Recognition in Dyadic Dialogue Videos,https://aclweb.org/anthology/N18-1193
Recurrent Scale Approximation for Object Detection in CNN,https://arxiv.org/pdf/1707.09531v2.pdf
Identifying Well-formed Natural Language Questions,https://arxiv.org/pdf/1808.09419v1.pdf
Universal Transformers,https://arxiv.org/pdf/1807.03819v3.pdf
Coarse-to-Fine Attention Models for Document Summarization,https://aclweb.org/anthology/W17-4505
ArtTrack: Articulated Multi-person Tracking in the Wild,https://arxiv.org/pdf/1612.01465v3.pdf
End-to-end speech recognition using lattice-free MMI,https://www.danielpovey.com/files/2018_interspeech_end2end.pdf
3DMatch: Learning Local Geometric Descriptors from RGB-D Reconstructions,https://arxiv.org/pdf/1603.08182v3.pdf
#Exploration: A Study of Count-Based Exploration for Deep Reinforcement Learning,https://arxiv.org/pdf/1611.04717v3.pdf
Beyond Part Models: Person Retrieval with Refined Part Pooling (and a Strong Convolutional Baseline),https://arxiv.org/pdf/1711.09349v3.pdf
SVDNet for Pedestrian Retrieval,https://arxiv.org/pdf/1703.05693v4.pdf
See Better Before Looking Closer: Weakly Supervised Data Augmentation Network for Fine-Grained Visual Classification,https://arxiv.org/pdf/1901.09891v2.pdf
Sequence to Sequence Learning with Neural Networks,https://arxiv.org/pdf/1409.3215v3.pdf
Efficient Yet Deep Convolutional Neural Networks for Semantic Segmentation,https://arxiv.org/pdf/1707.08254v3.pdf
Faithful to the Original: Fact Aware Neural Abstractive Summarization,https://arxiv.org/pdf/1711.04434v1.pdf
Attentional Encoder Network for Targeted Sentiment Classification,https://arxiv.org/pdf/1902.09314v2.pdf
Multi-digit Number Recognition from Street View Imagery using Deep Convolutional Neural Networks,https://arxiv.org/pdf/1312.6082v4.pdf
Fast and Accurate Single Image Super-Resolution via Information Distillation Network,https://arxiv.org/pdf/1803.09454v1.pdf
Estimating individual treatment effect: generalization bounds and algorithms,https://arxiv.org/pdf/1606.03976v5.pdf
Variational Autoencoders for Collaborative Filtering,https://arxiv.org/pdf/1802.05814v1.pdf
Pose2Seg: Detection Free Human Instance Segmentation,https://arxiv.org/pdf/1803.10683v3.pdf
Face Detection Using Improved Faster RCNN,https://arxiv.org/pdf/1802.02142v1.pdf
Deep Speech: Scaling up end-to-end speech recognition,https://arxiv.org/pdf/1412.5567v2.pdf
Effective LSTMs for Target-Dependent Sentiment Classification,https://arxiv.org/pdf/1512.01100v2.pdf
A Language Model based Evaluator for Sentence Compression,https://aclweb.org/anthology/P18-2028
Discriminative Transfer Learning with Tree-based Priors,https://papers.nips.cc/paper/5029-discriminative-transfer-learning-with-tree-based-priors.pdf
Generating High Fidelity Images with Subscale Pixel Networks and Multidimensional Upscaling,https://arxiv.org/pdf/1812.01608v1.pdf
Learning Latent Opinions for Aspect-Level Sentiment Classification,https://www.aaai.org/ocs/index.php/AAAI/AAAI18/paper/download/17327/16110
Learning Convolutional Neural Networks for Graphs,https://arxiv.org/pdf/1605.05273v4.pdf
Learning a Discriminative Feature Network for Semantic Segmentation,https://arxiv.org/pdf/1804.09337v1.pdf
Discriminative Neural Sentence Modeling by Tree-Based Convolution,https://arxiv.org/pdf/1504.01106v5.pdf
Prototypical Networks for Few-shot Learning,https://arxiv.org/pdf/1703.05175v2.pdf
Deep Relevance Ranking Using Enhanced Document-Query Interactions,https://arxiv.org/pdf/1809.01682v2.pdf
Image Super-Resolution Using Very Deep Residual Channel Attention Networks,https://arxiv.org/pdf/1807.02758v2.pdf
Autofocus Layer for Semantic Segmentation,https://arxiv.org/pdf/1805.08403v3.pdf
Training with Exploration Improves a Greedy Stack-LSTM Parser,https://arxiv.org/pdf/1603.03793v2.pdf
"Less Grammar, More Features",https://aclweb.org/anthology/P14-1022
KEPLER: Keypoint and Pose Estimation of Unconstrained Faces by Learning Efficient H-CNN Regressors,https://arxiv.org/pdf/1702.05085v1.pdf
PolyNet: A Pursuit of Structural Diversity in Very Deep Networks,https://arxiv.org/pdf/1611.05725v2.pdf
Understanding Back-Translation at Scale,https://arxiv.org/pdf/1808.09381v2.pdf
Deep Graph Convolutional Encoders for Structured Data to Text Generation,https://arxiv.org/pdf/1810.09995v1.pdf
Deep Self-Taught Learning for Weakly Supervised Object Localization,https://arxiv.org/pdf/1704.05188v2.pdf
Convolutional Pose Machines,https://arxiv.org/pdf/1602.00134v4.pdf
SPLATNet: Sparse Lattice Networks for Point Cloud Processing,https://arxiv.org/pdf/1802.08275v4.pdf
DeepIM: Deep Iterative Matching for 6D Pose Estimation,https://arxiv.org/pdf/1804.00175v3.pdf
Language Models are Unsupervised Multitask Learners,https://d4mucfpksywv.cloudfront.net/better-language-models/language-models.pdf
CASENet: Deep Category-Aware Semantic Edge Detection,https://arxiv.org/pdf/1705.09759v1.pdf
"""Zero-Shot"" Super-Resolution using Deep Internal Learning",https://arxiv.org/pdf/1712.06087v1.pdf
Discriminative Gaifman Models,https://arxiv.org/pdf/1610.09369v1.pdf
Abstractive Text Classification Using Sequence-to-convolution Neural Networks,https://arxiv.org/pdf/1805.07745v4.pdf
GANFIT: Generative Adversarial Network Fitting for High Fidelity 3D Face Reconstruction,https://arxiv.org/pdf/1902.05978v2.pdf
Discriminative Unsupervised Feature Learning with Convolutional Neural Networks,https://papers.nips.cc/paper/5548-discriminative-unsupervised-feature-learning-with-convolutional-neural-networks.pdf
A Fast and Accurate Unconstrained Face Detector,https://arxiv.org/pdf/1408.1656v3.pdf
FaceNet: A Unified Embedding for Face Recognition and Clustering,https://arxiv.org/pdf/1503.03832v3.pdf
"Event2Mind: Commonsense Inference on Events, Intents, and Reactions",https://arxiv.org/pdf/1805.06939v1.pdf
Evaluation of Output Embeddings for Fine-Grained Image Classification,https://arxiv.org/pdf/1409.8403v2.pdf
Pixel2Mesh: Generating 3D Mesh Models from Single RGB Images,https://arxiv.org/pdf/1804.01654v2.pdf
Document Image Classification with Intra-Domain Transfer Learning and Stacked Generalization of Deep Convolutional Neural Networks,https://arxiv.org/pdf/1801.09321v3.pdf
Fraternal Dropout,https://arxiv.org/pdf/1711.00066v4.pdf
PointRCNN: 3D Object Proposal Generation and Detection from Point Cloud,https://arxiv.org/pdf/1812.04244v1.pdf
Detail-revealing Deep Video Super-resolution,https://arxiv.org/pdf/1704.02738v1.pdf
Multi-Task Deep Neural Networks for Natural Language Understanding,https://arxiv.org/pdf/1901.11504v1.pdf
PoseCNN: A Convolutional Neural Network for 6D Object Pose Estimation in Cluttered Scenes,https://arxiv.org/pdf/1711.00199v3.pdf
Full-Resolution Residual Networks for Semantic Segmentation in Street Scenes,https://arxiv.org/pdf/1611.08323v2.pdf
Recursive Deep Models for Semantic Compositionality Over a Sentiment Treebank,https://aclweb.org/anthology/D13-1170
"Fast, Accurate and Lightweight Super-Resolution with Neural Architecture Search",https://arxiv.org/pdf/1901.07261.pdf
Abstractive Text Summarization Using Sequence-to-Sequence RNNs and Beyond,https://arxiv.org/pdf/1602.06023v5.pdf
SubUNets: End-To-End Hand Shape and Continuous Sign Language Recognition,https://openaccess.thecvf.com/content_ICCV_2017/papers/Camgoz_SubUNets_End-To-End_Hand_ICCV_2017_paper.pdf
HorizonNet: Learning Room Layout with 1D Representation and Pano Stretch Data Augmentation,https://arxiv.org/pdf/1901.03861v2.pdf
Attention-over-Attention Neural Networks for Reading Comprehension,https://arxiv.org/pdf/1607.04423v4.pdf
A Parallel-Hierarchical Model for Machine Comprehension on Sparse Data,https://arxiv.org/pdf/1603.08884v1.pdf
R2CNN: Rotational Region CNN for Orientation Robust Scene Text Detection,https://arxiv.org/pdf/1706.09579v2.pdf
"HyperFace: A Deep Multi-task Learning Framework for Face Detection, Landmark Localization, Pose Estimation, and Gender Recognition",https://arxiv.org/pdf/1603.01249v3.pdf
Residual Dense Network for Image Restoration,https://arxiv.org/pdf/1812.10477v1.pdf
Neural Machine Translation by Jointly Learning to Align and Translate,https://arxiv.org/pdf/1409.0473v7.pdf
Gated Graph Sequence Neural Networks,https://arxiv.org/pdf/1511.05493v4.pdf
Molecular Graph Convolutions: Moving Beyond Fingerprints,https://arxiv.org/pdf/1603.00856v3.pdf
Single Shot Text Detector with Regional Attention,https://arxiv.org/pdf/1709.00138v1.pdf
Learning with Recursive Perceptual Representations,https://papers.nips.cc/paper/4747-learning-with-recursive-perceptual-representations.pdf
Timeception for Complex Action Recognition,https://arxiv.org/pdf/1812.01289v2.pdf
Deep Competitive Pathway Networks,https://arxiv.org/pdf/1709.10282v1.pdf
Person Re-identification by Local Maximal Occurrence Representation and Metric Learning,https://arxiv.org/pdf/1406.4216v2.pdf
Variational Bayesian Multiple Instance Learning With Gaussian Processes,https://openaccess.thecvf.com/content_cvpr_2017/papers/Haussmann_Variational_Bayesian_Multiple_CVPR_2017_paper.pdf
Making the V in VQA Matter: Elevating the Role of Image Understanding in Visual Question Answering,https://arxiv.org/pdf/1612.00837v3.pdf
Dynamic Coattention Networks For Question Answering,https://arxiv.org/pdf/1611.01604v4.pdf
Cloze-driven Pretraining of Self-attention Networks,https://arxiv.org/pdf/1903.07785v1.pdf
APAC: Augmented PAttern Classification with Neural Networks,https://arxiv.org/pdf/1505.03229v1.pdf
Learning Natural Language Inference with LSTM,https://arxiv.org/pdf/1512.08849v2.pdf
DuLa-Net: A Dual-Projection Network for Estimating Room Layouts from a Single RGB Panorama,https://arxiv.org/pdf/1811.11977v2.pdf
Do We Really Need to Collect Millions of Faces for Effective Face Recognition?,https://arxiv.org/pdf/1603.07057v2.pdf
Context Based Approach for Second Language Acquisition,https://aclweb.org/anthology/W18-0524
RefineNet: Multi-Path Refinement Networks for High-Resolution Semantic Segmentation,https://arxiv.org/pdf/1611.06612v3.pdf
CornerNet-Lite: Efficient Keypoint Based Object Detection,https://arxiv.org/pdf/1904.08900v1.pdf
Deep Interest Network for Click-Through Rate Prediction,https://arxiv.org/pdf/1706.06978v4.pdf
A Focused Dynamic Attention Model for Visual Question Answering,https://arxiv.org/pdf/1604.01485v1.pdf
SciBERT: Pretrained Contextualized Embeddings for Scientific Text,https://arxiv.org/pdf/1903.10676v1.pdf
DiSAN: Directional Self-Attention Network for RNN/CNN-Free Language Understanding,https://arxiv.org/pdf/1709.04696v3.pdf
Question Answering with Subgraph Embeddings,https://arxiv.org/pdf/1406.3676v3.pdf
Bilateral Multi-Perspective Matching for Natural Language Sentences,https://arxiv.org/pdf/1702.03814v3.pdf
MSG-GAN: Multi-Scale Gradient GAN for Stable Image Synthesis,https://arxiv.org/pdf/1903.06048v2.pdf
Deep contextualized word representations,https://arxiv.org/pdf/1802.05365v2.pdf
Parameter Re-Initialization through Cyclical Batch Size Schedules,https://arxiv.org/pdf/1812.01216v1.pdf
Evolution Strategies as a Scalable Alternative to Reinforcement Learning,https://arxiv.org/pdf/1703.03864v2.pdf
CosFace: Large Margin Cosine Loss for Deep Face Recognition,https://arxiv.org/pdf/1801.09414v2.pdf
Long Short-Term Memory-Networks for Machine Reading,https://arxiv.org/pdf/1601.06733v7.pdf
Iterative Alternating Neural Attention for Machine Reading,https://arxiv.org/pdf/1606.02245v4.pdf
Simple Baseline for Visual Question Answering,https://arxiv.org/pdf/1512.02167v2.pdf
Towards a Neural Statistician,https://arxiv.org/pdf/1606.02185v2.pdf
Perceptual Losses for Real-Time Style Transfer and Super-Resolution,https://arxiv.org/pdf/1603.08155v1.pdf
DeXpression: Deep Convolutional Neural Network for Expression Recognition,https://arxiv.org/pdf/1509.05371v2.pdf
Graph Capsule Convolutional Neural Networks,https://arxiv.org/pdf/1805.08090v4.pdf
Fractional Max-Pooling,https://arxiv.org/pdf/1412.6071v4.pdf
Joint 3D Proposal Generation and Object Detection from View Aggregation,https://arxiv.org/pdf/1712.02294v4.pdf
I Know What You Want: Semantic Learning for Text Comprehension,https://arxiv.org/pdf/1809.02794v2.pdf
DeepPrior++: Improving Fast and Accurate 3D Hand Pose Estimation,https://arxiv.org/pdf/1708.08325v1.pdf
Dialogue Act Recognition via CRF-Attentive Structured Network,https://arxiv.org/pdf/1711.05568v1.pdf
NICE: Non-linear Independent Components Estimation,https://arxiv.org/pdf/1410.8516v6.pdf
Look at Boundary: A Boundary-Aware Face Alignment Algorithm,https://arxiv.org/pdf/1805.10483v1.pdf
Scalable Person Re-Identification: A Benchmark,https://openaccess.thecvf.com/content_iccv_2015/papers/Zheng_Scalable_Person_Re-Identification_ICCV_2015_paper.pdf
Multi-Context Attention for Human Pose Estimation,https://arxiv.org/pdf/1702.07432v1.pdf
Semantic Image Synthesis with Spatially-Adaptive Normalization,https://arxiv.org/pdf/1903.07291v1.pdf
A Discriminatively Learned CNN Embedding for Person Re-identification,https://arxiv.org/pdf/1611.05666v2.pdf
Integral Human Pose Regression,https://arxiv.org/pdf/1711.08229v4.pdf
Non-Local Recurrent Network for Image Restoration,https://arxiv.org/pdf/1806.02919v2.pdf
DualGAN: Unsupervised Dual Learning for Image-to-Image Translation,https://arxiv.org/pdf/1704.02510v4.pdf
A Unified Multi-scale Deep Convolutional Neural Network for Fast Object Detection,https://arxiv.org/pdf/1607.07155v1.pdf
Unitary Evolution Recurrent Neural Networks,https://arxiv.org/pdf/1511.06464v4.pdf
First Order Generative Adversarial Networks,https://arxiv.org/pdf/1802.04591v2.pdf
There Are Many Consistent Explanations of Unlabeled Data: Why You Should Average,https://arxiv.org/pdf/1806.05594v3.pdf
Position-aware Attention and Supervised Data Improve Slot Filling,https://aclweb.org/anthology/D17-1004
Easy Transfer Learning By Exploiting Intra-domain Structures,https://arxiv.org/pdf/1904.01376v2.pdf
The One Hundred Layers Tiramisu: Fully Convolutional DenseNets for Semantic Segmentation,https://arxiv.org/pdf/1611.09326v3.pdf
Min-Entropy Latent Model for Weakly Supervised Object Detection,https://arxiv.org/pdf/1902.06057v1.pdf
Associative Embedding: End-to-End Learning for Joint Detection and Grouping,https://arxiv.org/pdf/1611.05424v2.pdf
Learning General Purpose Distributed Sentence Representations via Large Scale Multi-task Learning,https://arxiv.org/pdf/1804.00079v1.pdf
Real-Time Video Super-Resolution with Spatio-Temporal Networks and Motion Compensation,https://arxiv.org/pdf/1611.05250v2.pdf
Attentive Pooling Networks,https://arxiv.org/pdf/1602.03609v1.pdf
Covariance Pooling For Facial Expression Recognition,https://arxiv.org/pdf/1805.04855v1.pdf
Long-Term Feature Banks for Detailed Video Understanding,https://arxiv.org/pdf/1812.05038v2.pdf
An Empirical Evaluation of Deep Learning on Highway Driving,https://arxiv.org/pdf/1504.01716v3.pdf
Neural Natural Language Inference Models Enhanced with External Knowledge,https://arxiv.org/pdf/1711.04289v3.pdf
Challenges in Data-to-Document Generation,https://arxiv.org/pdf/1707.08052v1.pdf
Is Faster R-CNN Doing Well for Pedestrian Detection?,https://arxiv.org/pdf/1607.07032v2.pdf
Meta-Transfer Learning for Few-Shot Learning,https://arxiv.org/pdf/1812.02391v3.pdf
Facial Landmarks Detection by Self-Iterative Regression based Landmarks-Attention Network,https://arxiv.org/pdf/1803.06598v1.pdf
Densely Connected Attention Propagation for Reading Comprehension,https://arxiv.org/pdf/1811.04210v2.pdf
Learning Spatial-Aware Regressions for Visual Tracking,https://arxiv.org/pdf/1706.07457v2.pdf
Recurrent Relational Networks,https://arxiv.org/pdf/1711.08028v4.pdf
A Distributional Perspective on Reinforcement Learning,https://arxiv.org/pdf/1707.06887v1.pdf
Self-produced Guidance for Weakly-supervised Object Localization,https://arxiv.org/pdf/1807.08902v2.pdf
Revisiting Unreasonable Effectiveness of Data in Deep Learning Era,https://arxiv.org/pdf/1707.02968v2.pdf
Understanding Humans in Crowded Scenes: Deep Nested Adversarial Learning and A New Benchmark for Multi-Human Parsing,https://arxiv.org/pdf/1804.03287v3.pdf
Robust Face Detection via Learning Small Faces on Hard Images,https://arxiv.org/pdf/1811.11662v1.pdf
Left-Center-Right Separated Neural Network for Aspect-based Sentiment Analysis with Rotatory Attention,https://arxiv.org/pdf/1802.00892v1.pdf
Multi-style Generative Reading Comprehension,https://arxiv.org/pdf/1901.02262v1.pdf
Attribute-Aware Attention Model for Fine-grained Representation Learning,https://arxiv.org/pdf/1901.00392v1.pdf
Explaining and Harnessing Adversarial Examples,https://arxiv.org/pdf/1412.6572v3.pdf
